{
    "$schema": "https://json-schema.org/draft/2020-12/schema",
    "title": "Dataset Series Schema",
    "description": "A JSON schema for a dataset series file in the data catalog.",
    "type": "object",
    "required": [
        "dct:identifier",
        "dct:title",
        "dct:description",
        "dcat:contactPoint",
        "dct:publisher",
        "adms:status",
        "bv:classification",
        "bv:personalData",
        "dct:creator"
    ],
    "properties": {
        "schema:image": {
            "type": [
                "string",
                "null"
            ],
            "format": "uri",
            "title": "Image URL",
            "description": "URL for an image to be displayed in the data catalog. Choose an image that is related to the series content."
        },
        "dct:identifier": {
            "title": "Dataset series identifier",
            "type": "string",
            "description": "Identifier for this dataset series. If left empty, it will be automatically assigned."
        },
        "dct:title": {
            "title": "Dataset series title",
            "type": "object",
            "required": [
                "de",
                "fr"
            ],
            "description": "Title for the series in multiple languages.",
            "properties": {
                "de": {
                    "type": "string",
                    "pattern": "[a-zA-Z0-9_\\-\\s]{10,75}",
                    "title": "Deutsch"
                },
                "fr": {
                    "type": "string",
                    "pattern": "[a-zA-Z0-9_\\-\\s]{10,75}",
                    "title": "Français"
                },
                "it": {
                    "type": "string",
                    "pattern": "[a-zA-Z0-9_\\-\\s]{10,75}",
                    "title": "Italiano"
                },
                "en": {
                    "type": "string",
                    "pattern": "[a-zA-Z0-9_\\-\\s]{10,75}",
                    "title": "English"
                }
            }
        },
        "dct:description": {
            "title": "Dataset series description",
            "type": "object",
            "required": [
                "de",
                "fr"
            ],
            "description": "Description for the series in multiple languages.",
            "properties": {
                "de": {
                    "type": "string",
                    "title": "Deutsch"
                },
                "fr": {
                    "type": "string",
                    "title": "Français"
                },
                "it": {
                    "type": "string",
                    "title": "Italiano"
                },
                "en": {
                    "type": "string",
                    "title": "English"
                }
            }
        },
        "dcat:contactPoint": {
            "title": "Contact point",
            "description": "Contact information for potential inquiries about the dataset series.",
            "type": "object",
            "required": [
                "schema:name",
                "schema:email"
            ],
            "properties": {
                "schema:name": {
                    "type": "string",
                    "title": "Contact point name"
                },
                "schema:email": {
                    "type": "string",
                    "title": "Contact point email address"
                }
            }
        },
        "dct:publisher": {
            "title": "Publisher",
            "type": "string",
            "description": "Federal Office responsible for the data object",
            "enum": [
                "",
                "BLW-OFAG-UFAG-FOAG",
                "BLV-OSAV-USAV-FSVO"
            ]
        },
        "dct:creator": {
            "title": "Curator of the dataset series",
            "description": "Person responsible for the curation of the series (not the content of the datasets in it).",
            "type": "object",
              "required": [
                  "prov:agent"
              ],
              "properties": {
                  "prov:agent": {
                      "type": "string",
                      "title": "Personal ID from AdminDir"
                  },
                  "schema:name": {
                      "type": "string",
                      "title": "Name"
                  },
                  "schema:email": {
                      "type": "string",
                      "title": "email"
                  }
              }
        },
        "adms:status": {
            "title": "Status",
            "type": "string",
            "description": "Current status of the dataset series.",
            "enum": [
                "",
                "workInProgress",
                "validated",
                "published",
                "deleted",
                "archived"
            ]
        },
        "dcat:version": {
            "type": "string",
            "title": "Version",
            "description": "The version indicator following a Major.Minor.Patch schema (example: 2.1.4)."
        },
        "dcat:dataset": {
            "title": "Available datasets",
            "type": [
                "array",
                "null"
            ],
            "description": "References which dataset(s) are grouped within this dataset series. Please note that a Dataset may be referenced by multiple dataset series.",
            "items": {
                "type": "string"
            }
        },
        "foaf:page": {
            "type": [
                "array",
                "null"
            ],
            "title": "Related resources",
            "description": "Any related page, document or resource.",
            "items": {
                "type": "object",
                "required": [
                    "uri"
                ],
                "additionalProperties": false,
                "properties": {
                    "alias": {
                        "title": "Page alias",
                        "description": "Alias to be showed in the interface for this link.",
                        "type": "string"
                    },
                    "uri": {
                        "title": "url",
                        "description": "URL for the page, document or resource",
                        "type": [
                            "string",
                            "null"
                        ],
                        "format": "uri"
                    }
                }
            }
        },
        "schema:comment": {
            "title": "Comments",
            "type": "string",
            "description": "Additional comments or notes about the dataset series."
        },
        "dcat:keyword": {
            "type": [
                "array",
                "null"
            ],
            "title": "Keywords",
            "description": "Keywords describing the dataset series.",
            "items": {
                "type": "string"
            }
        },
        "dcatap:applicableLegislation": {
            "title": "Applicable legislation",
            "description": "The legislation that mandates or allows the creation or management of the dataset series.",
            "type": [
              "array",
              "null"
            ],
            "items": {
              "title": "URI",
              "type": [
                  "string",
                  "null"
              ],
              "format": "uri"
            }
        },
        "bv:classification": {
            "type": "string",
            "title": "Classification level",
            "description": "Classification level of the dataset according to the Swiss Informationssicherheitsgesetz, ISG. For information regarding the categorization, consult <a href='https://www.fedlex.admin.ch/eli/cc/2022/232/de#art_13'>the Swiss Informationssicherheitsgesetz article 13</a>",
            "enum": [
                "",
                "none",
                "internal",
                "confidential",
                "secret"
            ]
        },
        "bv:personalData": {
            "type": "string",
            "title": "Categorization DSG",
            "description": "Categorization regarding the Swiss data protection act. For information regarding the categorization, consult <a href='https://www.fedlex.admin.ch/eli/oc/2022/491/de#art_5'>the Swiss data protection act article 5</a>.",
            "enum": [
                "",
                "none",
                "personalData",
                "sensitivePersonalData"
            ]
        }
    }
}
