{
  "$schema": "https://json-schema.org/draft/2020-12/schema",
  "dct:identifier": "51c42dfb-76b1-40dd-928a-7d82020cc588",
  "dct:title": {
    "de": "Test-Datensatzserie FOAG - Deutsch",
    "fr": "Série de données test FOAG - Français",
    "it": "Serie di dati test FOAG - Italiano",
    "en": "Test dataset series FOAG - English"
  },
  "dct:description": {
    "de": "Testdatensatzserie für den internen FOAG-Datenkatalog",
    "fr": "Série de données test pour le catalogue de données interne FOAG",
    "it": "Serie di dati test per il catalogo dati interno FOAG",
    "en": "Test dataset series for the internal FOAG data catalog"
  },
  "dcat:contactPoint": {
    "schema:name": "GR-KDT",
    "schema:email": "kompetenzzentrumdigitaletransformation@blw.admin.ch"
  },
  "dct:publisher": "BLW-OFAG-UFAG-FOAG",
  "adms:status": "published",
  "bv:classification": "internal",
  "bv:personalData": "personalData",
  "dct:creator": {
    "prov:agent": "AGNT-789",
    "schema:name": "Dr. Test Curator",
    "schema:email": "curator@foag.test.ch"
  },
  "dcat:version": "1.0.0",
  "dcat:dataset": ["74fe0fa3-3dd2-44f4-a7f6-d9bb2c542920", "c41ed3f8-507f-43b1-bf9e-9b3d21495a0c"],
  "foaf:page": [
    {
      "alias": "Series Documentation",
      "uri": "https://docs.foag.test.ch/series"
    },
    {
      "alias": "Validation Report",
      "uri": "https://reports.foag.test.ch/series-456"
    }
  ],
  "schema:comment": "Test dataset series entry for FOAG validation",
  "dcat:keyword": ["agriculture", "edit-test"],
  "dcatap:applicableLegislation": [
    "https://legal.test.ch/series-art12",
    "https://legal.test.ch/series-art34"
  ]
}
